
    =========================== USB Port1 ===========================

Connection Status        : 0x01 (Device is connected)
Port Chain               : 2-5-1
Properties               : 0x01
 IsUserConnectable       : yes
 PortIsDebugCapable      : no
 PortHasMultiCompanions  : no
 PortConnectorIsTypeC    : no
ConnectionIndex          : 0x01 (Port 1)
CompanionIndex           : 0
 CompanionHubSymLnk      : USB#VID_05E3&PID_0616#5&521a615&0&21#{f18a0e88-c30c-11d0-8815-00a0c906bed8}
 CompanionPortNumber     : 0x01 (Port 1)
 -> CompanionPortChain   : 2-21-1

      ========================== Summary =========================
Vendor ID                : 0x0C45 (Sonix Technology Co., Ltd.)
Product ID               : 0x6366
Manufacturer String      : "Sonix Technology Co., Ltd."
Product String           : "292A-IPC-OV2710"
Serial                   : "SN0001"
USB Version              : 2.0 (480 Mbit/s)
Port maximum Speed       : High-Speed (Companion Port 2-21-1 is doing the SuperSpeed)
Device maximum Speed     : High-Speed
Device Connection Speed  : High-Speed
Self powered             : no
Demanded Current         : 500 mA
Used Endpoints           : 2
Video                    : UVC Version 1.00
                 -------- Default Video Modes --------
640 x 480 @ 30 fps       : Uncompressed

      ======================== USB Device ========================

        +++++++++++++++++ Device Information ++++++++++++++++++
Device Description       : USB Composite Device
Device Path              : \\?\USB#VID_0C45&PID_6366#SN0001#{a5dcbf10-6530-11d2-901f-00c04fb951ed} (GUID_DEVINTERFACE_USB_DEVICE)
Kernel Name              : \Device\USBPDO-10
Device ID                : USB\VID_0C45&PID_6366\SN0001
Hardware IDs             : USB\VID_0C45&PID_6366&REV_0100 USB\VID_0C45&PID_6366
Driver KeyName           : {36fc9e60-c465-11cf-8056-444553540000}\0026 (GUID_DEVCLASS_USB)
Driver                   : \SystemRoot\System32\drivers\usbccgp.sys (Version: 10.0.26100.3912  Date: 2025-05-30  Company: Microsoft Corporation)
Driver Inf               : C:\WINDOWS\inf\usb.inf
Legacy BusType           : PNPBus
Class                    : USB
Class GUID               : {36fc9e60-c465-11cf-8056-444553540000} (GUID_DEVCLASS_USB)
Service                  : usbccgp
Enumerator               : USB
Location Info            : Port_#0001.Hub_#0005
Address                  : 1
Location IDs             : PCIROOT(0)#PCI(1400)#USBROOT(0)#USB(5)#USB(1), ACPI(_SB_)#ACPI(PCI0)#ACPI(XHC_)#ACPI(RHUB)#ACPI(HS05)#USB(1)
Container ID             : {940f9849-5f87-5764-a6cb-3b282371c5fc}
Manufacturer Info        : (Standard USB Host Controller)
Capabilities             : 0x94 (Removable, UniqueID, SurpriseRemovalOK)
Status                   : 0x0180600A (DN_DRIVER_LOADED, DN_STARTED, DN_DISABLEABLE, DN_REMOVABLE, DN_NT_ENUMERATOR, DN_NT_DRIVER)
Problem Code             : 0
Address                  : 1
First Install Date       : 2025-08-07 06:21:51
Last Arrival Date        : 2025-08-09 09:41:27
Bus Relations            : USB\VID_0C45&PID_6366&MI_00\7&183af011&0&0000
EnhancedPowerMgmtEnabled : 0
Power State              : D0 (supported: D0, D2, D3, wake from D0, wake from D2)

        +++++++++++++++++ Registry USB Flags +++++++++++++++++
HKEY_LOCAL_MACHINE\SYSTEM\CurrentControlSet\Control\usbflags\0C4563660100
 osvc                    : REG_BINARY 00 00

        ---------------- Connection Information ---------------
Connection Index         : 0x01 (Port 1)
Connection Status        : 0x01 (DeviceConnected)
Current Config Value     : 0x01 (Configuration 1)
Device Address           : 0x0F (15)
Is Hub                   : 0x00 (no)
Device Bus Speed         : 0x02 (High-Speed)
Number of open Pipes     : 0x01 (1 pipe to data endpoints)
Pipe[0]                  : EndpointID=3  Direction=IN   ScheduleOffset=0  Type=Interrupt  wMaxPacketSize=0x10    bInterval=6   -> 2160 Bits/ms = 270000 Bytes/s
Data (HexDump)           : 01 00 00 00 12 01 00 02 EF 02 01 40 45 0C 66 63   ...........@E.fc
                           00 01 02 01 03 01 01 02 00 0F 00 01 00 00 00 01   ................
                           00 00 00 07 05 83 03 10 00 06 00 00 00 00         ..............

        --------------- Connection Information V2 -------------
Connection Index         : 0x01 (1)
Length                   : 0x10 (16 bytes)
SupportedUsbProtocols    : 0x03
 Usb110                  : 1 (yes, port supports USB 1.1)
 Usb200                  : 1 (yes, port supports USB 2.0)
 Usb300                  : 0 (no, port not supports USB 3.0) -> but Companion Port 2-21-1 does
 ReservedMBZ             : 0x00
Flags                    : 0x00
 DevIsOpAtSsOrHigher     : 0 (Device is not operating at SuperSpeed or higher)
 DevIsSsCapOrHigher      : 0 (Device is not SuperSpeed capable or higher)
 DevIsOpAtSsPlusOrHigher : 0 (Device is not operating at SuperSpeedPlus or higher)
 DevIsSsPlusCapOrHigher  : 0 (Device is not SuperSpeedPlus capable or higher)
 ReservedMBZ             : 0x00
Data (HexDump)           : 01 00 00 00 10 00 00 00 03 00 00 00 00 00 00 00   ................

    ---------------------- Device Descriptor ----------------------
bLength                  : 0x12 (18 bytes)
bDescriptorType          : 0x01 (Device Descriptor)
bcdUSB                   : 0x200 (USB Version 2.0)
bDeviceClass             : 0xEF (Miscellaneous)
bDeviceSubClass          : 0x02
bDeviceProtocol          : 0x01 (IAD - Interface Association Descriptor)
bMaxPacketSize0          : 0x40 (64 bytes)
idVendor                 : 0x0C45 (Sonix Technology Co., Ltd.)
idProduct                : 0x6366
bcdDevice                : 0x0100
iManufacturer            : 0x02 (String Descriptor 2)
 *!*ERROR  String descriptor not found
iProduct                 : 0x01 (String Descriptor 1)
 *!*ERROR  String descriptor not found
iSerialNumber            : 0x03 (String Descriptor 3)
 *!*ERROR  String descriptor not found
bNumConfigurations       : 0x01 (1 Configuration)
Data (HexDump)           : 12 01 00 02 EF 02 01 40 45 0C 66 63 00 01 02 01   .......@E.fc....
                           03 01                                             ..

    ------------------ Configuration Descriptor -------------------
bLength                  : 0x09 (9 bytes)
bDescriptorType          : 0x02 (Configuration Descriptor)
wTotalLength             : 0x0143 (323 bytes)
bNumInterfaces           : 0x02 (2 Interfaces)
bConfigurationValue      : 0x01 (Configuration 1)
iConfiguration           : 0x00 (No String Descriptor)
bmAttributes             : 0x80
 D7: Reserved, set 1     : 0x01
 D6: Self Powered        : 0x00 (no)
 D5: Remote Wakeup       : 0x00 (no)
 D4..0: Reserved, set 0  : 0x00
MaxPower                 : 0xFA (500 mA)
Data (HexDump)           : 09 02 43 01 02 01 00 80 FA 08 0B 00 02 0E 03 00   ..C.............
                           02 09 04 00 00 01 0E 01 00 00 0D 24 01 00 01 67   ...........$...g
                           00 C0 E1 E4 00 01 01 09 24 03 05 01 01 00 04 00   ........$.......
                           1A 24 06 03 70 33 F0 28 11 63 2E 4A BA 2C 68 90   .$..p3.(.c.J.,h.
                           EB 33 40 16 08 01 02 01 1F 00 1A 24 06 04 3F AE   .3@........$..?.
                           12 28 D7 BC 11 4E A3 57 6F 1E DE F7 D6 1D 08 01   .(...N.Wo.......
                           03 01 FF 00 12 24 02 01 01 02 00 00 00 00 00 00   .....$..........
                           00 00 03 00 00 00 0B 24 05 02 01 00 00 02 00 00   .......$........
                           00 07 05 83 03 10 00 06 05 25 03 10 00 09 04 01   .........%......
                           00 00 0E 02 00 00 0E 24 01 01 4D 00 81 00 05 00   .......$..M.....
                           00 00 01 00 1B 24 04 01 01 59 55 59 32 00 00 10   .....$...YUY2...
                           00 80 00 00 AA 00 38 9B 71 10 01 00 00 00 00 1E   ......8.q.......
                           24 05 01 00 80 02 E0 01 00 00 CA 08 00 00 CA 08   $...............
                           00 60 09 00 15 16 05 00 01 15 16 05 00 06 24 0D   .`............$.
                           01 01 04 09 04 01 01 01 0E 02 00 00 07 05 81 05   ................
                           80 00 01 09 04 01 02 01 0E 02 00 00 07 05 81 05   ................
                           00 01 01 09 04 01 03 01 0E 02 00 00 07 05 81 05   ................
                           20 03 01 09 04 01 04 01 0E 02 00 00 07 05 81 05    ...............
                           20 0B 01 09 04 01 05 01 0E 02 00 00 07 05 81 05    ...............
                           20 13 01 09 04 01 06 01 0E 02 00 00 07 05 81 05    ...............
                           00 14 01                                          ...

        ------------------- IAD Descriptor --------------------
bLength                  : 0x08 (8 bytes)
bDescriptorType          : 0x0B (Interface Association Descriptor)
bFirstInterface          : 0x00 (Interface 0)
bInterfaceCount          : 0x02 (2 Interfaces)
bFunctionClass           : 0x0E (Video)
bFunctionSubClass        : 0x03 (Video Interface Collection)
bFunctionProtocol        : 0x00 (PC_PROTOCOL_UNDEFINED)
iFunction                : 0x02 (String Descriptor 2)
 *!*ERROR  String descriptor not found
Data (HexDump)           : 08 0B 00 02 0E 03 00 02                           ........

        ---------------- Interface Descriptor -----------------
bLength                  : 0x09 (9 bytes)
bDescriptorType          : 0x04 (Interface Descriptor)
bInterfaceNumber         : 0x00 (Interface 0)
bAlternateSetting        : 0x00
bNumEndpoints            : 0x01 (1 Endpoint)
bInterfaceClass          : 0x0E (Video)
bInterfaceSubClass       : 0x01 (Video Control)
bInterfaceProtocol       : 0x00
iInterface               : 0x00 (No String Descriptor)
Data (HexDump)           : 09 04 00 00 01 0E 01 00 00                        .........

        ------- Video Control Interface Header Descriptor -----
bLength                  : 0x0D (13 bytes)
bDescriptorType          : 0x24 (Video Control Interface)
bDescriptorSubtype       : 0x01 (Video Control Header)
bcdUVC                   : 0x0100 (UVC Version 1.00)
wTotalLength             : 0x0067 (103 bytes)
dwClockFreq              : 0x00E4E1C0 (15 MHz)
bInCollection            : 0x01 (1 VideoStreaming interface)
baInterfaceNr[1]         : 0x01 (Interface 1)
Data (HexDump)           : 0D 24 01 00 01 67 00 C0 E1 E4 00 01 01            .$...g.......

        ------- Video Control Output Terminal Descriptor ------
bLength                  : 0x09 (9 bytes)
bDescriptorType          : 0x24 (Video Control Interface)
bDescriptorSubtype       : 0x03 (Output Terminal)
bTerminalID              : 0x05 (5)
wTerminalType            : 0x0101 (TT_STREAMING)
bAssocTerminal           : 0x00 (Not associated with an Input Terminal)
bSourceID                : 0x04 (4)
iTerminal                : 0x00 (No String Descriptor)
Data (HexDump)           : 09 24 03 05 01 01 00 04 00                        .$.......

        --------- Video Control Extension Unit Descriptor -----
bLength                  : 0x1A (26 bytes)
bDescriptorType          : 0x24 (Video Control Interface)
bDescriptorSubtype       : 0x06 (Extension Unit)
bUnitID                  : 0x03 (ID 3)
guidExtensionCode        : {28F03370-6311-4A2E-BA2C-6890EB334016}
bNumControls             : 0x08 (8 Controls)
bNrInPins                : 0x01 (1 Input Pin)
baSourceID[1]            : 0x02
bControlSize             : 0x01 (1 bytes)
bmControls               : 0x1F
 D0                      : 1  yes -  Vendor-Specific (Optional)
 D1                      : 1  yes -  Vendor-Specific (Optional)
 D2                      : 1  yes -  Vendor-Specific (Optional)
 D3                      : 1  yes -  Vendor-Specific (Optional)
 D4                      : 1  yes -  Vendor-Specific (Optional)
 D5                      : 0   no -  Vendor-Specific (Optional)
 D6                      : 0   no -  Vendor-Specific (Optional)
 D7                      : 0   no -  Vendor-Specific (Optional)
iExtension               : 0x00 (No String Descriptor)
Data (HexDump)           : 1A 24 06 03 70 33 F0 28 11 63 2E 4A BA 2C 68 90   .$..p3.(.c.J.,h.
                           EB 33 40 16 08 01 02 01 1F 00                     .3@.......

        --------- Video Control Extension Unit Descriptor -----
bLength                  : 0x1A (26 bytes)
bDescriptorType          : 0x24 (Video Control Interface)
bDescriptorSubtype       : 0x06 (Extension Unit)
bUnitID                  : 0x04 (ID 4)
guidExtensionCode        : {2812AE3F-BCD7-4E11-A357-6F1EDEF7D61D}
bNumControls             : 0x08 (8 Controls)
bNrInPins                : 0x01 (1 Input Pin)
baSourceID[1]            : 0x03
bControlSize             : 0x01 (1 bytes)
bmControls               : 0xFF
 D0                      : 1  yes -  Vendor-Specific (Optional)
 D1                      : 1  yes -  Vendor-Specific (Optional)
 D2                      : 1  yes -  Vendor-Specific (Optional)
 D3                      : 1  yes -  Vendor-Specific (Optional)
 D4                      : 1  yes -  Vendor-Specific (Optional)
 D5                      : 1  yes -  Vendor-Specific (Optional)
 D6                      : 1  yes -  Vendor-Specific (Optional)
 D7                      : 1  yes -  Vendor-Specific (Optional)
iExtension               : 0x00 (No String Descriptor)
Data (HexDump)           : 1A 24 06 04 3F AE 12 28 D7 BC 11 4E A3 57 6F 1E   .$..?..(...N.Wo.
                           DE F7 D6 1D 08 01 03 01 FF 00                     ..........

        -------- Video Control Input Terminal Descriptor ------
bLength                  : 0x12 (18 bytes)
bDescriptorType          : 0x24 (Video Control Interface)
bDescriptorSubtype       : 0x02 (Input Terminal)
bTerminalID              : 0x01 (1)
wTerminalType            : 0x0201 (ITT_CAMERA)
bAssocTerminal           : 0x00 (Not associated with an Output Terminal)
iTerminal                : 0x00 (No String Descriptor)
Camera Input Terminal Data:
wObjectiveFocalLengthMin : 0x0000
wObjectiveFocalLengthMax : 0x0000
wOcularFocalLength       : 0x0000
bControlSize             : 0x03 (3 bytes)
bmControls               : 0x00, 0x00, 0x00
 D0                      : 0   no -  Scanning Mode
 D1                      : 0   no -  Auto-Exposure Mode
 D2                      : 0   no -  Auto-Exposure Priority
 D3                      : 0   no -  Exposure Time (Absolute)
 D4                      : 0   no -  Exposure Time (Relative)
 D5                      : 0   no -  Focus (Absolute)
 D6                      : 0   no -  Focus (Relative)
 D7                      : 0   no -  Iris (Absolute)
 D8                      : 0   no -  Iris (Relative)
 D9                      : 0   no -  Zoom (Absolute)
 D10                     : 0   no -  Zoom (Relative)
 D11                     : 0   no -  Pan (Absolute)
 D12                     : 0   no -  Pan (Relative)
 D13                     : 0   no -  Roll (Absolute)
 D14                     : 0   no -  Roll (Relative)
 D15                     : 0   no -  Tilt (Absolute)
 D16                     : 0   no -  Tilt (Relative)
 D17                     : 0   no -  Focus Auto
 D18                     : 0   no -  Reserved
 D19                     : 0   no -  Reserved
 D20                     : 0   no -  Reserved
 D21                     : 0   no -  Reserved
 D22                     : 0   no -  Reserved
 D23                     : 0   no -  Reserved
Data (HexDump)           : 12 24 02 01 01 02 00 00 00 00 00 00 00 00 03 00   .$..............
                           00 00                                             ..

        -------- Video Control Processing Unit Descriptor -----
bLength                  : 0x0B (11 bytes)
bDescriptorType          : 0x24 (Video Control Interface)
bDescriptorSubtype       : 0x05 (Processing Unit)
bUnitID                  : 0x02 (2)
bSourceID                : 0x01 (1)
wMaxMultiplier           : 0x0000
bControlSize             : 0x02 (2 bytes)
bmControls               : 0x00, 0x00
 D0                      : 0   no -  Brightness
 D1                      : 0   no -  Contrast
 D2                      : 0   no -  Hue
 D3                      : 0   no -  Saturation
 D4                      : 0   no -  Sharpness
 D5                      : 0   no -  Gamma
 D6                      : 0   no -  White Balance Temperature
 D7                      : 0   no -  White Balance Component
 D8                      : 0   no -  Backlight Compensation
 D9                      : 0   no -  Gain
 D10                     : 0   no -  Power Line Frequency
 D11                     : 0   no -  Hue, Auto
 D12                     : 0   no -  White Balance Temperature, Auto
 D13                     : 0   no -  White Balance Component, Auto
 D14                     : 0   no -  Digital Multiplier
 D15                     : 0   no -  Digital Multiplier Limit
iProcessing              : 0x00 (No String Descriptor)
Data (HexDump)           : 0B 24 05 02 01 00 00 02 00 00 00                  .$.........

        ----------------- Endpoint Descriptor -----------------
bLength                  : 0x07 (7 bytes)
bDescriptorType          : 0x05 (Endpoint Descriptor)
bEndpointAddress         : 0x83 (Direction=IN EndpointID=3)
bmAttributes             : 0x03 (TransferType=Interrupt)
wMaxPacketSize           : 0x0010
 Bits 15..13             : 0x00 (reserved, must be zero)
 Bits 12..11             : 0x00 (0 additional transactions per microframe -> allows 1..1024 bytes per packet)
 Bits 10..0              : 0x10 (16 bytes per packet)
bInterval                : 0x06 (32 microframes -> 4 ms)
Data (HexDump)           : 07 05 83 03 10 00 06                              .......

        --- Class-specific VC Interrupt Endpoint Descriptor ---
bLength                  : 0x05 (5 bytes)
bDescriptorType          : 0x25 (Video Control Endpoint)
bDescriptorSubtype       : 0x03 (Interrupt)
wMaxTransferSize         : 0x0010 (16 bytes)
Data (HexDump)           : 05 25 03 10 00                                    .%...

        ---------------- Interface Descriptor -----------------
bLength                  : 0x09 (9 bytes)
bDescriptorType          : 0x04 (Interface Descriptor)
bInterfaceNumber         : 0x01 (Interface 1)
bAlternateSetting        : 0x00
bNumEndpoints            : 0x00 (Default Control Pipe only)
bInterfaceClass          : 0x0E (Video)
bInterfaceSubClass       : 0x02 (Video Streaming)
bInterfaceProtocol       : 0x00
iInterface               : 0x00 (No String Descriptor)
Data (HexDump)           : 09 04 01 00 00 0E 02 00 00                        .........

        ---- VC-Specific VS Video Input Header Descriptor -----
bLength                  : 0x0E (14 bytes)
bDescriptorType          : 0x24 (Video Streaming Interface)
bDescriptorSubtype       : 0x01 (Input Header)
bNumFormats              : 0x01
wTotalLength             : 0x004D (77 bytes)
bEndpointAddress         : 0x81 (Direction=IN  EndpointID=1)
bmInfo                   : 0x00 (Dynamic Format Change not supported)
bTerminalLink            : 0x05 (Output Terminal ID 5)
bStillCaptureMethod      : 0x00 (No Still Capture)
nbTriggerSupport         : 0x00 (Hardware Triggering not supported)
bTriggerUsage            : 0x00 (Host will initiate still image capture)
bControlSize             : 0x01 (1 bytes each)
Video Payload Format 1   : 0x00
 D0                      : 0   no -  Key Frame Rate
 D1                      : 0   no -  P Frame Rate
 D2                      : 0   no -  Compression Quality
 D3                      : 0   no -  Compression Window Size
 D4                      : 0   no -  Generate Key Frame
 D5                      : 0   no -  Update Frame Segment
 D6                      : 0   no -  Reserved
 D7                      : 0   no -  Reserved
Data (HexDump)           : 0E 24 01 01 4D 00 81 00 05 00 00 00 01 00         .$..M.........

        ------- VS Uncompressed Format Type Descriptor --------
bLength                  : 0x1B (27 bytes)
bDescriptorType          : 0x24 (Video Streaming Interface)
bDescriptorSubtype       : 0x04 (Uncompressed Format Type)
bFormatIndex             : 0x01 (1)
bNumFrameDescriptors     : 0x01 (1 Frame Descriptor)
guidFormat               : {32595559-0000-0010-8000-00AA00389B71} (YUY2)
bBitsPerPixel            : 0x10 (16 bits per pixel)
bDefaultFrameIndex       : 0x01 (Index 1)
bAspectRatioX            : 0x00
bAspectRatioY            : 0x00
bmInterlaceFlags         : 0x00
 D0 IL stream or variable: 0 (no)
 D1 Fields per frame     : 0 (2 fields)
 D2 Field 1 first        : 0 (no)
 D3 Reserved             : 0
 D4..5 Field pattern     : 0 (Field 1 only)
 D6..7 Display Mode      : 0 (Bob only)
bCopyProtect             : 0x00 (No restrictions)
Data (HexDump)           : 1B 24 04 01 01 59 55 59 32 00 00 10 00 80 00 00   .$...YUY2.......
                           AA 00 38 9B 71 10 01 00 00 00 00                  ..8.q......

        -------- VS Uncompressed Frame Type Descriptor --------
---> This is the Default (optimum) Frame index
bLength                  : 0x1E (30 bytes)
bDescriptorType          : 0x24 (Video Streaming Interface)
bDescriptorSubtype       : 0x05 (Uncompressed Frame Type)
bFrameIndex              : 0x01
bmCapabilities           : 0x00
wWidth                   : 0x0280 (640)
wHeight                  : 0x01E0 (480)
dwMinBitRate             : 0x08CA0000 (147456000 bps -> 18.432 MB/s)
dwMaxBitRate             : 0x08CA0000 (147456000 bps -> 18.432 MB/s)
dwMaxVideoFrameBufferSize: 0x00096000 (614400 bytes)
dwDefaultFrameInterval   : 0x00051615 (33.3333 ms -> 30.0000 fps)
bFrameIntervalType       : 0x01 (1 discrete frame interval supported)
adwFrameInterval[1]      : 0x00051615 (33.3333 ms -> 30.0000 fps)
Data (HexDump)           : 1E 24 05 01 00 80 02 E0 01 00 00 CA 08 00 00 CA   .$..............
                           08 00 60 09 00 15 16 05 00 01 15 16 05 00         ..`...........

        ------- VS Color Matching Descriptor Descriptor -------
bLength                  : 0x06 (6 bytes)
bDescriptorType          : 0x24 (Video Streaming Interface)
bDescriptorSubtype       : 0x0D (Color Matching)
bColorPrimaries          : 0x01 (BT.709, sRGB)
bTransferCharacteristics : 0x01 (BT.709)
bMatrixCoefficients      : 0x04 (SMPTE 170M)
Data (HexDump)           : 06 24 0D 01 01 04                                 .$....

        ---------------- Interface Descriptor -----------------
bLength                  : 0x09 (9 bytes)
bDescriptorType          : 0x04 (Interface Descriptor)
bInterfaceNumber         : 0x01 (Interface 1)
bAlternateSetting        : 0x01
bNumEndpoints            : 0x01 (1 Endpoint)
bInterfaceClass          : 0x0E (Video)
bInterfaceSubClass       : 0x02 (Video Streaming)
bInterfaceProtocol       : 0x00
iInterface               : 0x00 (No String Descriptor)
Data (HexDump)           : 09 04 01 01 01 0E 02 00 00                        .........

        ----------------- Endpoint Descriptor -----------------
bLength                  : 0x07 (7 bytes)
bDescriptorType          : 0x05 (Endpoint Descriptor)
bEndpointAddress         : 0x81 (Direction=IN EndpointID=1)
bmAttributes             : 0x05 (TransferType=Isochronous  SyncType=Asynchronous  EndpointType=Data)
wMaxPacketSize           : 0x0080
 Bits 15..13             : 0x00 (reserved, must be zero)
 Bits 12..11             : 0x00 (0 additional transactions per microframe -> allows 1..1024 bytes per packet)
 Bits 10..0              : 0x80 (128 bytes per packet)
bInterval                : 0x01 (1 microframe -> 0.125 ms)
Data (HexDump)           : 07 05 81 05 80 00 01                              .......

        ---------------- Interface Descriptor -----------------
bLength                  : 0x09 (9 bytes)
bDescriptorType          : 0x04 (Interface Descriptor)
bInterfaceNumber         : 0x01 (Interface 1)
bAlternateSetting        : 0x02
bNumEndpoints            : 0x01 (1 Endpoint)
bInterfaceClass          : 0x0E (Video)
bInterfaceSubClass       : 0x02 (Video Streaming)
bInterfaceProtocol       : 0x00
iInterface               : 0x00 (No String Descriptor)
Data (HexDump)           : 09 04 01 02 01 0E 02 00 00                        .........

        ----------------- Endpoint Descriptor -----------------
bLength                  : 0x07 (7 bytes)
bDescriptorType          : 0x05 (Endpoint Descriptor)
bEndpointAddress         : 0x81 (Direction=IN EndpointID=1)
bmAttributes             : 0x05 (TransferType=Isochronous  SyncType=Asynchronous  EndpointType=Data)
wMaxPacketSize           : 0x0100
 Bits 15..13             : 0x00 (reserved, must be zero)
 Bits 12..11             : 0x00 (0 additional transactions per microframe -> allows 1..1024 bytes per packet)
 Bits 10..0              : 0x100 (256 bytes per packet)
bInterval                : 0x01 (1 microframe -> 0.125 ms)
Data (HexDump)           : 07 05 81 05 00 01 01                              .......

        ---------------- Interface Descriptor -----------------
bLength                  : 0x09 (9 bytes)
bDescriptorType          : 0x04 (Interface Descriptor)
bInterfaceNumber         : 0x01 (Interface 1)
bAlternateSetting        : 0x03
bNumEndpoints            : 0x01 (1 Endpoint)
bInterfaceClass          : 0x0E (Video)
bInterfaceSubClass       : 0x02 (Video Streaming)
bInterfaceProtocol       : 0x00
iInterface               : 0x00 (No String Descriptor)
Data (HexDump)           : 09 04 01 03 01 0E 02 00 00                        .........

        ----------------- Endpoint Descriptor -----------------
bLength                  : 0x07 (7 bytes)
bDescriptorType          : 0x05 (Endpoint Descriptor)
bEndpointAddress         : 0x81 (Direction=IN EndpointID=1)
bmAttributes             : 0x05 (TransferType=Isochronous  SyncType=Asynchronous  EndpointType=Data)
wMaxPacketSize           : 0x0320
 Bits 15..13             : 0x00 (reserved, must be zero)
 Bits 12..11             : 0x00 (0 additional transactions per microframe -> allows 1..1024 bytes per packet)
 Bits 10..0              : 0x320 (800 bytes per packet)
bInterval                : 0x01 (1 microframe -> 0.125 ms)
Data (HexDump)           : 07 05 81 05 20 03 01                              .... ..

        ---------------- Interface Descriptor -----------------
bLength                  : 0x09 (9 bytes)
bDescriptorType          : 0x04 (Interface Descriptor)
bInterfaceNumber         : 0x01 (Interface 1)
bAlternateSetting        : 0x04
bNumEndpoints            : 0x01 (1 Endpoint)
bInterfaceClass          : 0x0E (Video)
bInterfaceSubClass       : 0x02 (Video Streaming)
bInterfaceProtocol       : 0x00
iInterface               : 0x00 (No String Descriptor)
Data (HexDump)           : 09 04 01 04 01 0E 02 00 00                        .........

        ----------------- Endpoint Descriptor -----------------
bLength                  : 0x07 (7 bytes)
bDescriptorType          : 0x05 (Endpoint Descriptor)
bEndpointAddress         : 0x81 (Direction=IN EndpointID=1)
bmAttributes             : 0x05 (TransferType=Isochronous  SyncType=Asynchronous  EndpointType=Data)
wMaxPacketSize           : 0x0B20
 Bits 15..13             : 0x00 (reserved, must be zero)
 Bits 12..11             : 0x01 (1 additional transactions per microframe -> allows 513..1024 byte per packet)
 Bits 10..0              : 0x320 (800 bytes per packet)
bInterval                : 0x01 (1 microframe -> 0.125 ms)
Data (HexDump)           : 07 05 81 05 20 0B 01                              .... ..

        ---------------- Interface Descriptor -----------------
bLength                  : 0x09 (9 bytes)
bDescriptorType          : 0x04 (Interface Descriptor)
bInterfaceNumber         : 0x01 (Interface 1)
bAlternateSetting        : 0x05
bNumEndpoints            : 0x01 (1 Endpoint)
bInterfaceClass          : 0x0E (Video)
bInterfaceSubClass       : 0x02 (Video Streaming)
bInterfaceProtocol       : 0x00
iInterface               : 0x00 (No String Descriptor)
Data (HexDump)           : 09 04 01 05 01 0E 02 00 00                        .........

        ----------------- Endpoint Descriptor -----------------
bLength                  : 0x07 (7 bytes)
bDescriptorType          : 0x05 (Endpoint Descriptor)
bEndpointAddress         : 0x81 (Direction=IN EndpointID=1)
bmAttributes             : 0x05 (TransferType=Isochronous  SyncType=Asynchronous  EndpointType=Data)
wMaxPacketSize           : 0x1320
 Bits 15..13             : 0x00 (reserved, must be zero)
 Bits 12..11             : 0x02 (2 additional transactions per microframe -> allows 683..1024 bytes per packet)
 Bits 10..0              : 0x320 (800 bytes per packet)
bInterval                : 0x01 (1 microframe -> 0.125 ms)
Data (HexDump)           : 07 05 81 05 20 13 01                              .... ..

        ---------------- Interface Descriptor -----------------
bLength                  : 0x09 (9 bytes)
bDescriptorType          : 0x04 (Interface Descriptor)
bInterfaceNumber         : 0x01 (Interface 1)
bAlternateSetting        : 0x06
bNumEndpoints            : 0x01 (1 Endpoint)
bInterfaceClass          : 0x0E (Video)
bInterfaceSubClass       : 0x02 (Video Streaming)
bInterfaceProtocol       : 0x00
iInterface               : 0x00 (No String Descriptor)
Data (HexDump)           : 09 04 01 06 01 0E 02 00 00                        .........

        ----------------- Endpoint Descriptor -----------------
bLength                  : 0x07 (7 bytes)
bDescriptorType          : 0x05 (Endpoint Descriptor)
bEndpointAddress         : 0x81 (Direction=IN EndpointID=1)
bmAttributes             : 0x05 (TransferType=Isochronous  SyncType=Asynchronous  EndpointType=Data)
wMaxPacketSize           : 0x1400
 Bits 15..13             : 0x00 (reserved, must be zero)
 Bits 12..11             : 0x02 (2 additional transactions per microframe -> allows 683..1024 bytes per packet)
 Bits 10..0              : 0x400 (1024 bytes per packet)
bInterval                : 0x01 (1 microframe -> 0.125 ms)
Data (HexDump)           : 07 05 81 05 00 14 01                              .......

    --------- Device Qualifier Descriptor (for Full-Speed) --------
bLength                  : 0x0A (10 bytes)
bDescriptorType          : 0x06 (Device_qualifier Descriptor)
bcdUSB                   : 0x200 (USB Version 2.0)
bDeviceClass             : 0xEF (Miscellaneous)
bDeviceSubClass          : 0x02
bDeviceProtocol          : 0x01 (IAD - Interface Association Descriptor)
bMaxPacketSize0          : 0x40 (64 Bytes)
bNumConfigurations       : 0x01 (1 other-speed configuration)
bReserved                : 0x00
Data (HexDump)           : 0A 06 00 02 EF 02 01 40 01 00                     .......@..

    ------------ Other Speed Configuration Descriptor -------------
bLength                  : 0x09 (9 bytes)
bDescriptorType          : 0x07 (Other_speed_configuration Descriptor)
wTotalLength             : 0x0040 (64 bytes)
bNumInterfaces           : 0x01 (1 Interface)
bConfigurationValue      : 0x01 (Configuration 1)
iConfiguration           : 0x00 (No String Descriptor)
bmAttributes             : 0x80
 D7: Reserved, set 1     : 0x01
 D6: Self Powered        : 0x00 (no)
 D5: Remote Wakeup       : 0x00 (no)
 D4..0: Reserved, set 0  : 0x00
MaxPower                 : 0xFA (500 mA)
Data (HexDump)           : 09 07 40 00 01 01 00 80 FA 08 0B 00 01 0E 03 00   ..@.............
                           01 09 04 00 00 00 0E 01 00 01 0C 24 01 00 01 26   ...........$...&
                           00 80 8D 5B 00 00 09 24 03 05 01 01 00 02 00 11   ...[...$........
                           24 02 01 01 02 00 00 00 00 00 00 00 00 02 00 00   $...............

        ------------------- IAD Descriptor --------------------
bLength                  : 0x08 (8 bytes)
bDescriptorType          : 0x0B (Interface Association Descriptor)
bFirstInterface          : 0x00 (Interface 0)
bInterfaceCount          : 0x01 (1 Interface)
*!*ERROR  bInterfaceCount must be greater than 1
bFunctionClass           : 0x0E (Video)
bFunctionSubClass        : 0x03 (Video Interface Collection)
bFunctionProtocol        : 0x00 (PC_PROTOCOL_UNDEFINED)
iFunction                : 0x01 (String Descriptor 1)
 *!*ERROR  String descriptor not found
Data (HexDump)           : 08 0B 00 01 0E 03 00 01                           ........

        ---------------- Interface Descriptor -----------------
bLength                  : 0x09 (9 bytes)
bDescriptorType          : 0x04 (Interface Descriptor)
bInterfaceNumber         : 0x00 (Interface 0)
bAlternateSetting        : 0x00
bNumEndpoints            : 0x00 (Default Control Pipe only)
bInterfaceClass          : 0x0E (Video)
bInterfaceSubClass       : 0x01 (Video Control)
bInterfaceProtocol       : 0x00
iInterface               : 0x01 (String Descriptor 1)
 *!*ERROR  String descriptor not found
Data (HexDump)           : 09 04 00 00 00 0E 01 00 01                        .........

        ------- Video Control Interface Header Descriptor -----
bLength                  : 0x0C (12 bytes)
bDescriptorType          : 0x24 (Video Control Interface)
bDescriptorSubtype       : 0x01 (Video Control Header)
bcdUVC                   : 0x0100 (UVC Version 1.00)
wTotalLength             : 0x0026 (38 bytes)
dwClockFreq              : 0x005B8D80 (6 MHz)
bInCollection            : 0x00 (0 VideoStreaming interface)
Data (HexDump)           : 0C 24 01 00 01 26 00 80 8D 5B 00 00               .$...&...[..

        ------- Video Control Output Terminal Descriptor ------
bLength                  : 0x09 (9 bytes)
bDescriptorType          : 0x24 (Video Control Interface)
bDescriptorSubtype       : 0x03 (Output Terminal)
bTerminalID              : 0x05 (5)
wTerminalType            : 0x0101 (TT_STREAMING)
bAssocTerminal           : 0x00 (Not associated with an Input Terminal)
bSourceID                : 0x02 (2)
iTerminal                : 0x00 (No String Descriptor)
Data (HexDump)           : 09 24 03 05 01 01 00 02 00                        .$.......

        -------- Video Control Input Terminal Descriptor ------
bLength                  : 0x11 (17 bytes)
bDescriptorType          : 0x24 (Video Control Interface)
bDescriptorSubtype       : 0x02 (Input Terminal)
bTerminalID              : 0x01 (1)
wTerminalType            : 0x0201 (ITT_CAMERA)
bAssocTerminal           : 0x00 (Not associated with an Output Terminal)
iTerminal                : 0x00 (No String Descriptor)
Camera Input Terminal Data:
wObjectiveFocalLengthMin : 0x0000
wObjectiveFocalLengthMax : 0x0000
wOcularFocalLength       : 0x0000
bControlSize             : 0x02 (2 bytes)
bmControls               : 0x00, 0x00
 D0                      : 0   no -  Scanning Mode
 D1                      : 0   no -  Auto-Exposure Mode
 D2                      : 0   no -  Auto-Exposure Priority
 D3                      : 0   no -  Exposure Time (Absolute)
 D4                      : 0   no -  Exposure Time (Relative)
 D5                      : 0   no -  Focus (Absolute)
 D6                      : 0   no -  Focus (Relative)
 D7                      : 0   no -  Iris (Absolute)
 D8                      : 0   no -  Iris (Relative)
 D9                      : 0   no -  Zoom (Absolute)
 D10                     : 0   no -  Zoom (Relative)
 D11                     : 0   no -  Pan (Absolute)
 D12                     : 0   no -  Pan (Relative)
 D13                     : 0   no -  Roll (Absolute)
 D14                     : 0   no -  Roll (Relative)
 D15                     : 0   no -  Tilt (Absolute)
Data (HexDump)           : 11 24 02 01 01 02 00 00 00 00 00 00 00 00 02 00   .$..............
                           00                                                .

      -------------------- String Descriptors -------------------
none
